[
  {
    "candidateId": "petgearbench:B00O0UIPTY",
    "siteId": "petgearbench",
    "productName": "SureFeed Microchip Pet Feeder",
    "model": "MPF001 / manufacturer item 194705",
    "variant": "Standard version, white, one feeder",
    "asin": "B00O0UIPTY",
    "affiliateUrl": "https://www.amazon.com/dp/B00O0UIPTY/ref=nosim?tag=abbeybench-20",
    "buyerProblem": "Keep two cats on separate foods when one cat steals meals or one cat needs a different diet.",
    "decisionSlot": "default",
    "bestFor": "A grazing cat that needs protected access to wet or dry food without wearing a collar tag, provided its implanted microchip is compatible and readable.",
    "skipIf": "You need timed dispensing from a hopper, refuse C-cell battery upkeep, or have a persistent thief that can reach around an open feeder.",
    "mainTradeoff": "It controls bowl access but does not dispense scheduled portions, and the open back can require an accessory guard for a determined food thief.",
    "closestAlternative": "Closer Pets MiBowl CP500 for a more enclosed bowl-access design.",
    "editorialThesis": "The strongest default is the simpler microchip bowl for households that need food separation more than scheduled dispensing or app features.",
    "experienceBasis": "research-only",
    "evidence": [
      {
        "type": "amazon-listing",
        "url": "https://www.amazon.com/dp/B00O0UIPTY",
        "note": "Verified specification: the current listing identifies ASIN B00O0UIPTY as the SureFeed Microchip Pet Feeder MPF001 standard version, white, manufacturer item 194705, for wet or dry food.",
        "checkedAt": "2026-07-21"
      },
      {
        "type": "manufacturer",
        "url": "https://www.surepetcare.com/en-us/support/microchip-pet-feeder",
        "note": "Manufacturer documentation: official setup, cleaning, dimensions, serial-specific manuals, and training resources support the standard non-connected feeder identity and ownership requirements.",
        "checkedAt": "2026-07-21"
      },
      {
        "type": "owner-pattern",
        "url": "https://www.reddit.com/r/CatAdvice/comments/1s70j63/questions_for_anyone_who_uses_the_surepet/",
        "note": "Owner-reported pattern: multiple long-term users describe successful separate-diet feeding and easy daily use; repeated tradeoffs are C-cell battery replacement and the need to train some cats.",
        "checkedAt": "2026-07-20"
      },
      {
        "type": "safety",
        "url": "https://www.saferproducts.gov/RestWebServices/Recall?ProductName=SureFeed&format=json",
        "note": "Official recall check: the CPSC recall API returned no matching SureFeed product recall records on 2026-07-20. This is a database check, not a safety certification.",
        "checkedAt": "2026-07-20"
      }
    ],
    "strengths": [
      "Reads a compatible implanted microchip or the supplied RFID collar tag.",
      "Supports both wet and dry food in a covered bowl.",
      "Training mode and a long-running product family reduce adoption uncertainty.",
      "The non-connected design avoids an app, hub, and account dependency."
    ],
    "failureModes": [
      "A persistent cat may reach food from the rear while the authorized cat keeps the lid open.",
      "A migrated or incompatible implanted microchip may not read reliably.",
      "Four C-cell batteries add recurring upkeep and there is no corded fallback.",
      "It does not schedule or dispense meals, so owners must refill the bowl manually."
    ],
    "hardGates": {
      "asinVerified": true,
      "distinctDecisionSlot": true,
      "noUnresolvedSafetyIssue": true,
      "claimsSupportable": true,
      "affiliateCompliance": true
    },
    "score": {
      "readerProblemFit": 24,
      "evidenceConfidence": 19,
      "ownershipLongevity": 13,
      "meaningfulDifferentiation": 13,
      "riskAndReturnFit": 12,
      "demandSignal": 4,
      "commercialValue": 3,
      "total": 88
    },
    "decision": "approve",
    "decisionReason": "Approve as the default food-separation candidate. The exact ASIN and standard variant are current, the evidence mix clears every hard gate, and it solves the reader's actual problem without making an app or collar tag mandatory. The guide must still disclose that it is a protected bowl rather than a scheduled hopper and that determined cats may require a rear guard.",
    "activation": {
      "status": "activated",
      "activatedAt": "2026-07-21",
      "guidePath": "/guides/best-automatic-cat-feeders-two-cats/"
    },
    "sourceRun": "product-discovery:2026-07-20",
    "researchedAt": "2026-07-20",
    "lastVerifiedAt": "2026-07-21"
  },
  {
    "candidateId": "petgearbench:B09ZLJCYSR",
    "siteId": "petgearbench",
    "productName": "Closer Pets MiBowl Smart Selective Microchip Pet Feeder",
    "model": "CP500",
    "variant": "White, one feeder, 12-ounce bowl",
    "asin": "B09ZLJCYSR",
    "affiliateUrl": "https://www.amazon.com/dp/B09ZLJCYSR/ref=nosim?tag=abbeybench-20",
    "buyerProblem": "Keep two cats on separate foods when one cat steals meals or one cat needs a different diet.",
    "decisionSlot": "constraint",
    "bestFor": "Small or medium cats whose food thief is persistent enough that an enclosed rear and side design matters more than scheduled dispensing.",
    "skipIf": "Your pet lacks a compatible 15-digit implanted microchip and will not tolerate the supplied collar tag, or you need app tracking or hopper-fed scheduled meals.",
    "mainTradeoff": "The enclosed access design is stronger against side and rear stealing, but it is still a manually filled bowl powered by four C-cell batteries.",
    "closestAlternative": "SureFeed Microchip Pet Feeder MPF001 for the more established and simpler default.",
    "editorialThesis": "MiBowl earns a separate shortlist slot for households where enclosure geometry is the deciding constraint, not as a generic second microchip feeder.",
    "experienceBasis": "research-only",
    "evidence": [
      {
        "type": "amazon-listing",
        "url": "https://www.amazon.com/dp/B09ZLJCYSR",
        "note": "Verified specification: the current listing identifies ASIN B09ZLJCYSR as Closer Pets MiBowl model CP500, white, one unit, with the manufacturer selling the listing and a 12-ounce bowl.",
        "checkedAt": "2026-07-21"
      },
      {
        "type": "manufacturer",
        "url": "https://closerpets.com/products/mibowl-automatic-microchip-pet-feeder-cp500",
        "note": "Manufacturer claim: the CP500 uses a compatible implanted microchip or supplied electronic ID disc and encloses the rear and sides to limit unauthorized access to wet or dry food.",
        "checkedAt": "2026-07-21"
      },
      {
        "type": "manual",
        "url": "https://closerpets.com/pages/support_mibowl_and_mibowl_plus_cp500",
        "note": "Manufacturer documentation: official CP500 support confirms wet-or-dry use, 12-ounce bowl capacity, compatible implanted chips or ID discs, programming, cleaning, and battery-life caveats.",
        "checkedAt": "2026-07-20"
      },
      {
        "type": "owner-pattern",
        "url": "https://www.ebay.com/urw/-/product-reviews/24060821130",
        "note": "Owner-reported pattern: reviewers repeatedly cite the enclosed design as useful against a larger greedy cat, while setup and pet acclimation remain household-dependent.",
        "checkedAt": "2026-07-20"
      },
      {
        "type": "safety",
        "url": "https://www.saferproducts.gov/RestWebServices/Recall?ProductName=MiBowl&format=json",
        "note": "Official recall check: the CPSC recall API returned no matching MiBowl product recall records on 2026-07-20. This is a database check, not a safety certification.",
        "checkedAt": "2026-07-20"
      }
    ],
    "strengths": [
      "The enclosed back and sides directly address reach-around food theft.",
      "Works with compatible implanted microchips or an included electronic ID disc.",
      "Accepts wet or dry food and keeps the feeding posture relatively open at the front.",
      "The manufacturer provides current CP500 support and replacement-bowl guidance."
    ],
    "failureModes": [
      "It does not dispense scheduled portions and must be filled manually.",
      "A non-compatible or migrated implanted chip can force collar-tag use.",
      "A cautious cat may resist the moving lid without gradual training.",
      "Four C-cell batteries and bowl cleaning remain recurring ownership tasks."
    ],
    "hardGates": {
      "asinVerified": true,
      "distinctDecisionSlot": true,
      "noUnresolvedSafetyIssue": true,
      "claimsSupportable": true,
      "affiliateCompliance": true
    },
    "score": {
      "readerProblemFit": 23,
      "evidenceConfidence": 18,
      "ownershipLongevity": 12,
      "meaningfulDifferentiation": 14,
      "riskAndReturnFit": 12,
      "demandSignal": 2,
      "commercialValue": 2,
      "total": 83
    },
    "decision": "approve",
    "decisionReason": "Approve for the persistent-thief constraint slot. The exact CP500 listing is current and manufacturer-sold, the evidence mix clears every hard gate, and the enclosed geometry is a meaningful difference from the default rather than redundant feature churn. Activation copy must avoid promising that any feeder can defeat every determined cat.",
    "activation": {
      "status": "activated",
      "activatedAt": "2026-07-21",
      "guidePath": "/guides/best-automatic-cat-feeders-two-cats/"
    },
    "sourceRun": "product-discovery:2026-07-20",
    "researchedAt": "2026-07-20",
    "lastVerifiedAt": "2026-07-21"
  },
  {
    "candidateId": "petgearbench:B0FJMFYPNH",
    "siteId": "petgearbench",
    "productName": "PETLIBRO One RFID Smart Feeder",
    "model": "PLAF301 / Amazon item AF301-W",
    "variant": "White, 3-liter, pack of one, included proprietary RFID collar tag",
    "asin": "B0FJMFYPNH",